"Crees que cuando sea presidenta, le van a pagar lo mismo que le pagaran si fuera un hombre?
"
"There's a lot more that unites us than divides us.
"
"If you see a bully, stand up to him. "
Lower wages! No paid family leave! Limited access to health care! Just some of the perks of your #WomanCard:
"Estas son las promesas de Trump. As podra ser su presidencia.
"
"Get your own #WomanCard*: 

*does not include a 21% discount on your purchases. "
An entire deck of woman cards? Deal us in.
What can we do to fight the Zika threat? Hillary answers on
"If you see bigotry, oppose it. If you see violence, condemn it. If you see a bully, stand up to him.
"
Conoce alguno de los logros de Hillary Clinton a travs de los aos.
Want one? Chip in now:  #WomanCard
"If fighting for women is ""playing the #WomanCard,"" what card is Trump playing?
"
Hate isn't an American value.
Fact: Donald Trump said women should be punished for seeking an abortion.
"Couldn't agree more,  It's time for Republicans to address this threat:  -H "
#TBT to 2008 when Hillary helped make emergency contraception available over the counter:
". Does Donald Trump intimidate you?

Hillary: No. #TBT
"
"Candidate Trump opposes equal pay, paid leave, and Planned Parenthood.

President Trump? Same.
"
Capt. Kristen Griest is about to become the Army's first female infantry officer. Well done.  -H
"""Everything I say, I'm going to do, folks."" 
"
"Turning away Muslims, pitting Americans against each other, inciting violence and chaosthese aren't our values.
"
The  has 5% of the world's women but nearly 30% of its women prisoners. The consequences are devastating.
Yikes.
"Donald Trump's foreign policy isn't just offensive, it's dangerous.  "
"So if fighting for women is playing the #WomanCard,  "
Trump's rhetoric is just the beginning. He's dismissed equal pay. Wouldn't support paid family leave. Would defund Planned Parenthood.
Women still face too many barriersa president shouldn't be part of the problem. Comments like Trump's set us back.
"They might make flashy headlines, but Trump's comments aren't a joke. Hillary can handle these attacks. Millions of women shouldn't have to."
"Last night, the ""#womancard."" This morning, Trump said he ""hasn't recovered"" from Hillary's ""shouting."" Really? "
"After a week of reports that Trump would change his tone heading into the general election, once again he's letting his true colors show."
Donald Trump's anti-Muslim rhetoric goes against everything we stand for.
"Civil rights and voting rights.
Workers rights and womens rights.

Let's defend them all.
"
"Fighting for women's health care, equal pay, and paid leave.
Or as Donald Trump says, playing the ""woman's card.""
"
"""That is how progress gets made: We have to be both dreamers and doers."" Hillary last night in PA "
"Caught your speech,  About that ""woman's 
"
"Imagine a tomorrow where hard work is honored, families are supported, communities are strong, and love trumps hate.
"
"Thank you, Connecticut. "
Text IMWITHHER to 47246 to tell Hillary you've got her back.
"Thanks to you, victory is in sight. Pitch in $1, and let's go win this nomination: "
"""Lets go forward. Lets win the nomination."" Hillary  "
"""Imagine a tomorrow  trumps hate. Hillary"
"Imagine a tomorrow where instead of building walls, were breaking down barriers. Hillary "
"If fighting for womens health care and paid family leave and equal pay is playing the woman card, then deal me in. Hillary"
"Civil rights &amp; voting rights.
Workers rights &amp; womens rights.
LGBT rights and rights for people with disabilities.

Let's defend them all."
"""We all agree that wages are too low and inequality is too high. That Wall Street can never again be allowed to threaten Main Street."""
"""We can build on a strong progressive tradition from Franklin Roosevelt to Barack Obama."" Hillary"
"Whether you support Senator Sanders or you support me, theres much more that unites us than divides us. Hillary"
"""Our campaign is about restoring peoples confidence in our ability to solve problems together"" Hillary"
"Americans are hungry for solutions. They dont just want us to diagnose problems, they want us to solve them."
"More than 1.1 million have donated.
Chip in now to join this team: "
"""Were going to come back to  the most votes and the most pledged delegates. Well unify our party to win this election."
Watch live: Hillary speaks on tonight's primary results in Philadelphia.
"Tonight's wins belong to every organizer, volunteer, donor, and supporter who've built this campaign. Thank you. "
"Vote by vote, state by state, this team is building something special. Thanks for believing. -H "
Pennsylvania! Thanks to everyone who made this possible. This win is yours.
"We did it, Delaware! "
"Thank you, Maryland. "
Three answers from last nights  town hall that you should see:
Love this. Great to see Chobani sharing its success with the employees who helped make it possible. -H
"Polls close soon in CT, DE, MD, PA, and RI. Confirm where to go here, then head over:  "
"We are not a post-racial society. We still struggle with racismand it's not only wrong, it's holding us back.
"
"If our leaders won't stand up to the gun lobby, we need to hold them accountable.
"
"Live in CT, DE, MD, PA, or RI? Go vote: Hillary needs you. Text WHERE to 47246 to find your polling place. "
"Women deserve the same rights as men in every aspect of our economy and our societyat home and around the world.
"
"Its Primary Day in CT, DE, MD, PA, and RI. If youre with Hillary, add your name and make a plan to vote today: "
"Primarias en Connecticut, Maryland, Pensilvania, Delaware y Rhode Island. #EstoyConElla  "
"We've heard way too much hateful rhetoric in this campaign.

We need more love and kindness.
"
"Voters in CT, DE, MD, PA, and RI head to the polls today.  this if youre voting for Hillary. "
"America's gun violence epidemic is out of control. No more excuseswe need to act to save lives.
"
"""I'm a feminist because I believe women deserve the same rights as men."" Hillary #MSNBCTownhall"
"""As a white person, I have to talk about [racism] more. We are not a post-racial society."" Hillary to  #MSNBCTownhall"
"Eight-year-old Noah became part of Hillary's Secret Service detail this weekend. Here's how.
"
"Connecticut, Maryland, Pensilvania, Delaware y Rhode Island.  #EstoyConElla "
"""Voters can count on her to bring that same passion for getting the job done to the White House."" "
She's more accomplished than any other candidate.
"This might sound strange coming from a presidential candidate, but what we really need is more love and kindness.
"
"In 1990, explorer and marine biologist Sylvia Earle became the first woman appointed chief scientist at  "
"""Ms. Clinton has advanced realistic, well thought out proposals.""   "
Editorial boards in Tuesday primary states are urging their readers to vote for Hillary Clinton. Here's why.
"Let's stand together to do all the good we can, in all the ways we can, for as long as we can.
"
"""Everybody has a story. Everybody has a life worth dignity and protection.""
"
La lucha por la cobertura mdica a bajo costo lleva ms de medio siglo y Hillary ha sido una lder por dcadas.
Not interested in endorsements from people who deny climate science and try to make it harder for people to vote.
"When someone shows you who they are, believe them. Trump has shown us who he is.
"
Women gathered in Seneca Falls 170 years ago to demand suffrage.  visited before voting for her mom.
"Uno no se intimida cuando se tienen que denunciar abusos a los derechos humanos.
"
"Every child in America deserves clean air to breathe, clean water to drink, and a safe and healthy place to live. "
"Tenemos que actuar ahora para proteger a los puertorriqueos (del Zika), especialmente a las mujeres embarazadas. "
Does Trump think he can fool us into forgetting his hateful rhetoric? Sad!
Zika has reached the  and we can't wait any longer to act. Tell Congress to address this public health crisis:
"We all know Donald Trump says offensive things about women. Here's what he says about policies that benefit women.
"
Passover is a chance to gather with loved ones and recommit to fighting all forms of injustice. Chag sameach to those celebrating. -H
"Para dejarle un mejor futuro a nuestros nios, tenemos que proteger el futuro de nuestro planeta. #DiaDeLaTierra "
"In ten years, we can generate enough renewable energy to power every home in America. #EarthDay
"
Proud of my friend  for continuing to break down barriers to voting. -H
"The climate is changing.
Republican policies aren't.

 if you agree we need to #ActOnClimate.
"
We need to act on Zikafast. Add your name and tell Congress: approve emergency funding now to keep families safe.
"""It is not enough to be on the money. You need to be making the money."" Hillary on ensuring equal pay for women"
Zika is a threat to public health &amp; we have to act now. Tell Congress to approve funding to address this crisis:  -H
Proud the  is signing the Paris climate deal. What better way to celebrate Earth Day than taking action to help save our planet? -H
"To make a better future for our kids, we've got to protect the future of our planet. Happy Earth Day. "
Conoce la historia de un gimnasio en Nueva York ayudando a concienciar sobre la encarcelacin masiva.
"""To all the people who supported Sen. Sanders, I believe there's much more that unites us than divides us."" Hillary "
"It isn't enough to just say we support equal pay for women. We have to do everything we can to make it a reality.
"
"""Once you've paid your debt to society, your voting rights should be returned immediately."" Hillary on 
"
A few bad actors supply the vast majority of guns used in crimes. We need to stop them.
Gun violence is an epidemic. We cannot become indifferent to these losses.
"""We have got to address the unequal effects of the criminal justice system on people of color."" Hillary on 
"
"If anything else killed 33,000 people per year, Congress would take action. It's time to #StopGunViolence. "
"In which Hillary reacts to  Hillary skits on 
"
"Thank you, New York. Let's go win this nomination.
"
"""Victory"" never tasted so good. Thanks, 
"
"It's important that people are held accountable for water poisoning in Flint, but Congress needs to act now to help Flint families. -H"
"A fitting tribute yesterday for Susan B. Anthony, who fought to win women the right to vote: ""I voted"" stickers. "
"""No more families should have to go through what we have.""  daughter of Sandy Hook School principal
"
"A woman, a leader, and a freedom fighter. I can't think of a better choice for the $20 bill than Harriet Tubman:  -H"
Hillary Clinton luchar para los inmigrantes para que todos puedan salir adelante.
"""Erica has turned her sorrow into a strategy and her mourning into a movement."" Hillary in New York last night
"
"""Because of you, this campaign is the only oneDemocrat or Republicanto win 10 million votes. "
"""New York is a place for dreaming big. But New Yorkers also like to get things done."" Hillary "
Esta victoria es de todos ustedes Nueva York! Muchas gracias por su apoyo. Unete a la campaa aqu
Text CONGRATS to 47246 to tell Hillary you're with her tonight.
The motto of this state is Excelsiorever upward. So lets go out and win this election and all rise together.
"New Yorkers speak every language, worship every faith, and hail from every continent. 

Our diversity is a strength, not a weakness."
"Donald Trump &amp; Ted Cruz are pushing a vision for America that's divisive &amp; dangerous.

We should be lifting people upnot tearing them down."
"New York is a place to dream bigand were setting bold, progressive goals in this campaign. But New Yorkers also like to get things done."
The race for the Democratic nomination is in the home stretch and our goal is in sight.
"We did it, New York! Watch Hillary live: "
Start spreading the news.
Tonight's victory belongs to everyone who worked hard to get out the vote. Sign up now to keep the momentum going.
"To our volunteers, organizers, and supporters who worked your hearts out in New York: This is your win. Thank you. "
Let's win this nomination. Chip in $3 to let Hillary know you've got her back all the way to the White House:
"Right back at you, New York. "
"Thank you, New York. You put your faith in me 16 years ago and again tonight. I'll never stop fighting for you. -H "
"A couple of New Yorkers heading to the polls. #PrimaryDay
"
"Just a few hours left to vote in the NY primary. Confirm your polling place, then head over:  "
Cmo funciona el sistema de delegados? Nuestro experto en delegados nos explica en esta entrevista.
Just a few hours until polls close in New York. Get the latest from #PrimaryDay on our live blog
"If we have each other's backs and treat each other with kindness and respect, there's nothing we can't do.
"
"Our country can't reach its potential unless we all do.
"
It's #PrimaryDay in New York. Get all you need to know on our live blog:
"Go vote, New York. It'll only take you one try.  #PrimaryDay "
First stop on New York primary day. #iVoted #PrimaryDay
"We asked New Yorkers what they really think of Donald Trump.

They didnt hold back.  "
New Yorkers head to the polls today.  this if youre voting for Hillary.
Alza tu voz! Encuentre dnde votar en Nueva York aqu   #EstoyConElla
"Go vote today, New YorkHillary needs you. Text WHERE to 47246 to find your polling place."
Every Republican presidential candidate would reverse  executive actions on immigration.  #FightForFamilies
"We don't all look the same, or sound the same, or worship the sameand that's one of America's biggest strengths.
"
"Push forward into the unknown,  Watch Hillary on  at 11:30pm ET. #LSSC
"
". on Hillary: ""One of the most broadly and deeply qualified presidential candidates in modern history."" "
"""She promised me to block the Constitutional amendment against gay marriage. And she did.""  "
It's time to create a path to full and equal citizenship and finally fix our broken immigration system. #FightForFamilies -H
We need comprehensive immigration reform now. I'll propose legislation within my first 100 days as president. -H
I will protect President Obama's executive actions to keep these families together and go even further to bring more families relief. -H
"Millions of families who call America home live in fear of being torn apart by deportation. Today, SCOTUS begins deciding their fate. -H"
"To everyone in Houston, please stay safe and avoid traveling. Our prayers are with you. #HoustonFlood -H"
Encuentre dnde votar en Nueva York aqu    #EstoyConElla
"No child should have to live in fear of losing her parents to deportation. #FightForFamilies
"
". thanks for your work on this issue. Your zip code shouldn't determine your ability to access healthy, affordable food."
"""Anything is possible. Do not let where you come from dictate your life.""
How one New York school is changing lives: "
"If we stand up for our values instead of turning to division and hate, there's nothing we can't do.
"
Nuestros corazones estn con los ecuatorianos y las familias que perdieron a seres queridos en el terremoto de ayer.
Our hearts go out to the people of Ecuador and the families who lost loved ones from yesterday's earthquake. -H
"A great day in East Harlem, in photos.  "
Muchos neoyorquinos luchan por pagar la renta ... y las familias latinas y afroamericanas son las ms afectadas.
"A new friend in Brooklyn.
"
"""If a young man believes that he might be a senator or  don't have to tell them not to join a gang."" "
About 90 people are killed by guns every day in America. We can't accept that as normal. #StopGunViolence
"Behind the scenes on the campaign with YouTube star 
"
Latino households are more than twice as likely as white households to face severe housing cost burdens.
Kareem Abdul-Jabbar on Hillary: She can envision a better world and take the steps to make that vision a reality.
"It's time for us to say, ""enough is enough."" We have to protect families, not the gun lobby.
"
Thinking of Boston as we remember the bombing 3 years ago. Your strength and resilience will always defeat acts of terror. #OneBostonDay -H
". is right, Congress shouldn't cut GI Bill benefits. America should fulfill our commitment to our veterans.  -H"
"You can knock us down, but you can't keep us down.
We're always getting up. We're always moving forward.
"
A quarter of renters in the  spend more than half their income on rent. We need to make housing more affordable.
"In 1992, 75% of New York's prison population came from seven neighborhoods in NYC.  is changing that.
"
"If you thought last night's debate was 
"
"This couple lost their daughter in the Aurora shooting. Now, they have to pay the gun dealer's legal fees.
"
"We need a president who will take action on gun violence and stand with victims' families against the gun lobby.
"
"A typical woman working full-time is paid just 79% of what a man makes, but there's no discount for being a woman.
"
"""We have a presidential candidate by the name of Donald Trump saying that women should be punished."" "
Sen. Sanders couldn't name a time donations influenced Hillarybecause there are none. #DemDebate (via
"A record of results, from taking on the gun lobby to securing health care for millions of kids.  #DemDebate"
"Women's rights aren't a ""distraction."" They're at the heart of who we areand we need to defend them. "
One candidate delivers catchy linesthe other delivers results. Add your name to say you're with Hillary:  #DemDebate
"If we work together, we can change history. Chip in today and get your sticker:  "
if you're standing with Hillary tonight. #DemDebate
"""Together, we won't just make promises we can't keepwe'll deliver results that will improve the lives of the people of America."" Hillary"
Southern Democratic voters matter just as much as every other Democratic voter. #DemDebate
"Donald Trump said women should be punished for seeking an abortion. That's not a distractionit's a disgrace.
"
"""We're never asked about [abortion]this goes to who we are as women: our rights, autonomy, our ability to make our own decisions."" Hillary"
Republican governors would have to fund one third of  college plan. Not likely. #DemDebate
No American should have to take out a loan to pay tuition at a public college. We should also help people with existing student debt.
"At the #DemDebate, we agree we need universal health care. Thats why Hillarys been fighting for it for 20+ years. "
"We cant afford a President Trump, Cruz, or Kasich. We need a leader on women's rights. "
"With women's health under attack across the country, how is it possible that there hasn't been a single #DemDebate question on it?"
El planeta no puede esperar por una revolucin poltica. Necesitamos soluciones prcticas para combatir el cambio climtico. #DemDebate
Four years as secretary of stateshe's got a bit of experience on foreign policy.  #DemDebate
The planet can't wait for a political revolution. We need real solutions to fight climate change now.  #DemDebate
"""It's easy to diagnose the problem. It's harder to do something about the problem."" Hillary on combating climate change #DemDebate"
"We need a president who will always put families above the gun lobby. #DemDebate
"
"Todos los nios merecen una educacin de alta calidad no importa su origen tnico, los ingresos de su familia o donde vivan. #Demdebate"
You voted for the bill.  #DemDebate
"Every child, no matter his or her race, income, or ZIP code, should be guaranteed a high-quality education. #DemDebate"
We have to tackle systemic racism and fix our broken criminal justice system.  #DemDebate
There's only one candidate on stage who thinks gun makers should be held accountable for gun deaths.  #DemDebate
How is it possible that it's easier to sue a toy maker for endangering your child than a gun maker? #DemDebate
"33,000 people die every year in this country from guns. 90 each day. 1,000 shot a year in New York City. That's not acceptable. Full stop."
"Also saved by that vote: millions of jobs, the economy, and the auto industry. #DemDebate "
Democrats agree we need to hold big banks accountablebut Hillary's the only candidate who never voted to reduce oversight on Wall Street.
It's easy to say you'll fix Wall Streetit's harder to actually do it. Hillary has a plan to get it done.  #DemDebate
Sen. Sanders talks a lot about stopping special interests for someone who's voted with the NRA over and over again. #DemDebate
"""Sen. Sanders did call me unqualified. I've been called a lot of things in my lifethat was a first."" Hillary #DemDebate"
if you're cheering on Hillary tonight. #DemDebate
"Before Hillary takes the #DemDebate stage, check out her record of results: "
"#TBT to Hillary in a 2000 debate. Tune in for tonight's #DemDebate at 9:00  ET.
"
El #DemDebate es hoy! Enva LATINOS al 47246 para que Hillary sepa que ests con ella.
"""Ive been called many things by many people. 'Quitter' is not one of them."" #TBT #DemDebate "
"You don't make America great by getting rid of everything that made America great.

Watch CNN at 9pm ET. #DemDebate
"
La situacin del virus del Zika es urgente. Tenemos que invertir ahora para desarrollar una vacuna y tratamiento.
Donald Trump's made the most reckless statements on national security by any major candidate in modern history:
Ella puede unir a personas de cada comunidad y pienso que continuar haciendo eso.
This is urgent. We need to invest in a vaccine and treatment now. My heart goes out to parents impacted by Zika.  -H
Donald Trump says wages are too high. Really? Hardworking Americans don't think so.
Environmental justice isn't just a public health issueit's a civil rights issue.
Southerners votes count as much as everyone elseswhether you won them or not.
"""Hillary Clinton luchar por nosotros"". Tom Perez
"
"Durante dcadas de servicio al pas Hillary logr resultados, especialmente para las familias. Conoce 7 de ellos. "
"Speaking is hard for me. But come January, I want to say these two words: Madam President. 
"
Clean air shouldn't be a luxury in America.
American women are 11 times more likely to be murdered by a gun than in any other developed nation:  #StopGunViolence
"""Every child and every family in America deserves clean air to breathe, clean water to drink and a safe and healthy place to live."" Hillary"
Hillary's environmental justice plan would eliminate lead as a major public health threat within 5 years:
"What happened in Flint would never have happened in a wealthy, white suburb of Detroit. Hillary"
We need to break down every barrier holding families backand that includes environmental barriers.
Tune in to watch Hillary speak at  on her plan to fight for environmental justice:
"Even in states with strict gun laws, illegal weapons are often just a bus ride away. We have to fix this: "
New York  in Clinton a superprepared warrior realist.  endorsing Hillary:
"#EqualPayDay means it's taken this long into 2016 for women, on average, to catch up to what men made in 2015. "
"Theres no discount for being a womanyet women are still paid less. 

Myths on the wage gap, debunked:  #EqualPayDay"
"It's not like women get charged less than men for groceries.

We need to ensure equal pay.
"
We've made progress on equal paybut our work isn't done. Our next president needs to keep leading the fight for it.
Reminder for Republican legislators in PA: Every woman should be free to make her own health care decisions.
Women lose out on every paycheckand women of color feel it the most. Its time to close the pay gap. #EqualPayDay
"The average woman makes just  for every $1 a man earns.

 if you agree we have to fix that. #EqualPayDay "
From one Iowa road trip to a campaign that's millions strong: here's what weve built together in the past year.
"Women earn just  for every $1 men do. It's worse for women of color. Let's close that gap. #EqualPayDay -H
"
"One year ago today.
"
"Do you think that when youre president, youll be paid as much as a man? #EqualPayDay
"
"We can't afford a President Trump, Cruz, or Kasich. 

If you agree, get your sticker   "
"A majority of Americans (and gun owners) support steps to reduce gun violence.

 if you're one of them.
"
"We can't accept this as ""normal."" It's time to help stop gun violence:  "
"If toy companies are held accountable for endangering our kids, gun makers should be too. Let's end their immunity. "
We can protect our Second Amendment rights AND take commonsense steps to prevent gun violence. Its just a question of whether we choose to.
"33,000 Americans die from gun violence each year. No other developed country comes close.  "
Our next president should always prioritize families' safety over the NRA.
We need a leader who will bring us togethernot drive us apart.
Hard choices.
"Donald Trump says we can solve Americas problems by turning against each other. He's dead wrong.
"
"Hillary talked with  about being a wonk, standing up to bullies, and some great advice for flying. "
Scary.
"""I told my oncologist that I have to be there in November to cast my ballot.""
"
"Happy birthday to a personal hero, 
"
"Thank you for your support,  "
"Every American deserves to live free from discriminationno matter who they are or who they love.
"
"""No one is better prepared to help our working families.""  first lady of New York City "
"Donald Trump says wages are too high. (Yeah, you read that right.)
"
It's not just Trump: Every Republican presidential candidate has attacked women's health and rights.
Wouldn't be a Brooklyn campaign stop without a visit to
